{
  "version": {
    "major": 0,
    "minor": 0
  },
  "family": "request-graph",
  "requestId": "req-1",
  "kind": "query",
  "payload": {
    "context": {
      "workspaceId": "workspace-a",
      "projectId": "app",
      "compilationContextId": "ctx-3",
      "snapshot": {
        "hostId": "host-a",
        "documentUri": "workspace://sample/Counter.cs",
        "hostVersion": "v8",
        "snapshotId": "s8"
      }
    },
    "body": {
      "snapshot": {
        "hostId": "host-a",
        "documentUri": "workspace://sample/Counter.cs",
        "hostVersion": "v8",
        "snapshotId": "s8"
      },
      "coordinates": "utf16-offset",
      "start": 0,
      "length": 17
    },
    "detail": "full",
    "requireComplete": true
  },
  "extensions": {}
}
